2019-12-31,1729,2019-12-31,2019,12,19232582,3,1200 B/O 9th St NW,Sexual Orientation,Not Reported,Damage/Defacing/Destruction of Property,1200  9th St NW Washington DC,"Modern Liquors, 1200, 9th Street Northwest, Logan Circle/Shaw, Washington, District of Columbia, 20001, United States",38.9058143,-77.0241485,20001
2020-01-02,1145,2020-01-02,2020,1,20001016,2,3900 B/O Chesapeake St NW,Ethnicity/National Origin,Jewish,Displaying Symbols,3900  Chesapeake St NW Washington DC,"3900, Chesapeake Street Northwest, American University Park, Washington, District of Columbia, 20016, United States",38.950647,-77.077578,20016
2020-01-03,1418,2020-01-03,2020,1,20001659,2,3900 B/O Chesapeake St NW,Race,Black,Damage/Defacing/Destruction of Property,3900  Chesapeake St NW Washington DC,"3900, Chesapeake Street Northwest, American University Park, Washington, District of Columbia, 20016, United States",38.950647,-77.077578,20016
2020-01-03,2320,2020-01-04,2020,1,20001974,4,800 B/O Upshur St NW,Sexual Orientation,Not Reported,Stalking,800  Upshur St NW Washington DC,"800, Upshur Street Northwest, Petworth, Washington, District of Columbia, 20011, United States",38.941841,-77.023497,20011
2020-01-06,1050,2020-01-06,2020,1,20003221,4,1200 B/O Taylor St NW,Sexual Orientation,Not Reported,Simple Assault,1200  Taylor St NW Washington DC,"1200, Taylor Street Northwest, Petworth, Washington, District of Columbia, 20011, United States",38.940721,-77.026879,20011
2020-01-11,1800,2020-01-11,2020,1,20006677,2,800 B/O 17th St NW,Race,Black,Simple Assault,800  17th St NW Washington DC,"Compass Coffee, 800, 17th Street Northwest, Golden Triangle, Washington, District of Columbia, 20006, United States",38.900387,-77.0397796,20006
2020-01-12,144,2020-01-12,2020,1,20006772,2,1400 B/O 14th St NW,Sexual Orientation,Not Reported,Simple Assault,1400  14th St NW Washington DC,"Mai Place DC, 1400, 14th Street Northwest, Logan Circle/Shaw, Washington, District of Columbia, 20005, United States",38.90898285,-77.03225563481675,20005
2020-01-16,2101,2020-01-16,2020,1,20009814,2,1300 B/O F St NW,Race,White,Simple Assault,1300  F St NW Washington DC,"1300, F Street Northwest, Downtown, Washington, District of Columbia, 20004, United States",38.897262,-77.029778,20005
2020-01-24,1703,2020-01-24,2020,1,20014562,4,1400 B/O Tewkesbury Pl NW,Ethnicity/National Origin,Latino/Hispanic,ADW,1400  Tewkesbury Pl NW Washington DC,"Tewkesbury Place Northwest, Brightwood, Washington, District of Columbia, 20012, United States",38.9679333,-77.0237941,20012
2020-01-25,1413,2020-01-25,2020,1,20015126,2,4600 B/O Wisconsin Ave NW,Race,Black,Simple Assault,4600  Wisconsin Ave NW Washington DC,"Roaming Rooster, 4600, Wisconsin Avenue Northwest, Tenleytown, Friendship Heights, Washington, District of Columbia, 20016, United States",38.9499658,-77.0807406,20016
2020-01-28,2341,2020-01-29,2020,1,20017231,4,800 B/O Upshur St NW,Sexual Orientation,Not Reported,Stalking,800  Upshur St NW Washington DC,"800, Upshur Street Northwest, Petworth, Washington, District of Columbia, 20011, United States",38.941841,-77.023497,20011
2020-01-30,1534,2020-01-30,2020,1,20018329,7,2000 B/O Tremont St SE,Gender Identity/Expression,Not Reported,Simple Assault,2000  Tremont St SE Washington DC,"2000, Tremont Street Southeast, Shipley, Washington, District of Columbia, 20020, United States",38.84596733333333,-76.97546129292928,20020
2020-01-31,1847,2020-01-31,2020,1,20019058,4,800 B/O Upshur St NW,Sexual Orientation,Not Reported,Stalking,800  Upshur St NW Washington DC,"800, Upshur Street Northwest, Petworth, Washington, District of Columbia, 20011, United States",38.941841,-77.023497,20011
2020-02-01,115,2020-02-02,2020,2,20019792,5,200 B/O L St NE,Gender Identity/Expression,Not Reported,Simple Assault,200  L St NE Washington DC,"200, L Street Northeast, NoMa, Near Northeast, Washington, District of Columbia, 20002, United States",38.903813,-77.003412,20002
2020-02-06,1251,2020-02-06,2020,2,20022506,3,1400 B/O Girard St NW,Religion,Christian,Damage/Defacing/Destruction of Property,1400  Girard St NW Washington DC,"1400, Girard Street Northwest, Columbia Heights, Washington, District of Columbia, 20009, United States",38.92541,-77.032462,20009
2020-02-06,1320,2020-02-06,2020,2,20022524,6,4900 B/O Benning Rd SE,Sexual Orientation,Not Reported,Threats,4900  Benning Rd SE Washington DC,"4900, Benning Road Southeast, Marshall Heights, Washington, District of Columbia, 20019, United States",38.87987842667686,-76.93206876601397,20019
2020-02-09,1720,2020-02-09,2020,2,20024492,4,3700 B/O Georgia Ave NW,Gender Identity/Expression,Not Reported,Threats,3700  Georgia Ave NW Washington DC,"3700, Georgia Avenue Northwest, Petworth, Washington, District of Columbia, 20012, United States",38.937121,-77.0247125,20010
2020-02-09,1500,2020-02-09,2020,2,20024382,2,1400 B/O K St NW,Race,Black,Threats,1400  K St NW Washington DC,"PNC Bank, 1400, K Street Northwest (access road), Downtown, Washington, District of Columbia, 20071, United States",38.902167,-77.0324088,20071
2020-02-18,2140,2020-02-18,2020,2,20030020,5,300 B/O Evarts St NE,Race,Black,Damage/Defacing/Destruction of Property,300  Evarts St NE Washington DC,"Edgewood Recreation Center, 300, Evarts Street Northeast, Edgewood, Washington, District of Columbia, 20002, United States",38.9248685,-77.001845697135,20002
2020-02-21,1048,2020-02-21,2020,2,20031554,6,4200 B/O Blaine St NE,Sexual Orientation,Not Reported,ADW,4200  Blaine St NE Washington DC,"4200, Blaine Street Northeast, Benning, Washington, District of Columbia, 20019, United States",38.891974,-76.942448,20019
2020-02-23,305,2020-02-23,2020,2,20032681,2,Unit B/O Washington Cir NW,Race,Black,Simple Assault,  Washington Cir NW Washington DC,"Washington Circle NW, Washington, District of Columbia, 20036-5305, United States",38.9029417,-77.0496623,20036
2020-02-25,432,2020-02-25,2020,2,20033886,5,1500 B/O Benning Rd NE,Sexual Orientation,Not Reported,ADW,1500  Benning Rd NE Washington DC,"1500, Benning Road Northeast, Carver, Washington, District of Columbia, 20002, United States",38.9002011,-76.9818082,20002
2020-02-29,600,2020-02-29,2020,2,20036475,2,3400 B/O Connecticut Ave NW,Ethnicity/National Origin,Latino/Hispanic,Simple Assault,3400  Connecticut Ave NW Washington DC,"Xfinity, 3400, Connecticut Avenue Northwest, Northwest, Cleveland Park, Washington, District of Columbia, 20008, United States",38.9343448,-77.0584138,20008
2020-03-04,640,2020-03-04,2020,3,20038777,3,500 B/O N St NW,Ethnicity/National Origin,Latino/Hispanic,Simple Assault,500  N St NW Washington DC,"500, N Street Northwest, Logan Circle/Shaw, Washington, District of Columbia, 20001, United States",38.907156,-77.019093,20005
2020-03-14,1540,2020-03-14,2020,3,20045437,2,500 B/O 11th St NW,Ethnicity/National Origin,Latino/Hispanic,Threats,500  11th St NW Washington DC,"500, 11th Street Northwest, Downtown, Washington, District of Columbia, 20001, United States",38.896255,-77.027141,20001
2020-03-15,106,2020-03-15,2020,3,20045736,3,1500 B/O 7th St NW,Gender Identity/Expression,Not Reported,Threats,1500  7th St NW Washington DC,"1500, 7th Street Northwest, Logan Circle/Shaw, Washington, District of Columbia, 20001, United States",38.909769,-77.022018,20001
2020-03-18,1942,2020-03-18,2020,3,20047834,5,1900 B/O Michigan Ave NE,Gender Identity/Expression,Not Reported,ADW,1900  Michigan Ave NE Washington DC,"1900, Michigan Avenue Northeast, North Michigan Park, Washington, District of Columbia, 20017, United States",38.945368,-76.978887,20018
2020-03-19,2039,2020-03-19,2020,3,20048276,4,5900 B/O Georgia Ave NW,Gender Identity/Expression,Not Reported,Simple Assault,5900  Georgia Ave NW Washington DC,"Missouri Avenue Market, 5900, Georgia Avenue Northwest, Brightwood, Washington, District of Columbia, 20011, United States",38.9615177,-77.0284286,20012
2020-03-21,1243,2020-03-21,2020,3,20049063,5,2300 B/O Washington Pl NE,Race,Black,Simple Assault,2300  Washington Pl NE Washington DC,"uBreakiFix, 2300, Washington Place Northeast, Eckington, Washington, District of Columbia, 20018, United States",38.9207348,-76.9945103,20018
2020-03-24,1720,2020-03-24,2020,3,20050449,3,1800 B/O Monroe St NW,Sexual Orientation,Not Reported,Simple Assault,1800  Monroe St NW Washington DC,"1800, Monroe Street Northwest, Mount Pleasant, Washington, District of Columbia, 20010, United States",38.933204,-77.041446,20010
2020-03-24,1449,2020-03-24,2020,3,20050317,2,1400 B/O N St NW,Ethnicity/National Origin,Latino/Hispanic,ADW,1400  N St NW Washington DC,"1400, N Street Northwest, Logan Circle/Shaw, Washington, District of Columbia, 20005, United States",38.9070784,-77.0326174,20005
2020-03-26,0,2020-03-26,2020,3,20051275,2,2100 B/O P St NW,Ethnicity/National Origin,Black,Damage/Defacing/Destruction of Property,2100  P St NW Washington DC,"Vintage 78, 2100, P Street Northwest, Dupont Circle, Washington, District of Columbia, 20036-5305, United States",38.9094741,-77.0468669,20036
2020-03-31,1100,2020-04-01,2020,4,20053460,3,1300 B/O Clifton St NW,Sexual Orientation,Not Reported,Threats,1300  Clifton St NW Washington DC,"1300, Clifton Street Northwest, Columbia Heights, Washington, District of Columbia, 20009, United States",38.922346,-77.029861,20009
2020-04-04,1000,2020-04-06,2020,4,20055722,2,4800 B/O Glenbrook Rd NW,Ethnicity/National Origin,Jewish,Displaying Symbols,4800  Glenbrook Rd NW Washington DC,"4800, Glenbrook Road Northwest, Spring Valley, Washington, District of Columbia, 20016, United States",38.933632,-77.093579,20016
2020-04-15,2000,2020-04-15,2020,4,20059517,1,800 B/O 5th St NW,Gender Identity/Expression,Not Reported,Simple Assault,800  5th St NW Washington DC,"800, 5th Street Northwest, Chinatown, Washington, District of Columbia, 20001, United States",38.899934,-77.019031,20001
2020-04-26,1326,2020-04-26,2020,4,20063801,4,6500 B/O Georgia Ave NW,Gender Identity/Expression,Not Reported,Simple Assault,6500  Georgia Ave NW Washington DC,"Georgia Avenue Northwest, Takoma, Washington, District of Columbia, 20012, United States",38.9837103,-77.0265877,20012
2020-04-27,823,2020-04-27,2020,4,20064093,6,5100 B/O A St SE,Gender Identity/Expression,Not Reported,Threats,5100  A St SE Washington DC,"5100, A Street Southeast, Marshall Heights, Washington, District of Columbia, 20019, United States",38.887772,-76.927629,20019
2020-05-03,2130,2020-05-04,2020,5,20067328,2,3400 B/O Dent Pl NW,Race,Black,Damage/Defacing/Destruction of Property,3400  Dent Pl NW Washington DC,"3400, Dent Place Northwest, Georgetown, Washington, District of Columbia, 20007, United States",38.911634,-77.068043,20007
2020-05-09,1345,2020-05-09,2020,5,20069743,7,2200 B/O Savannah St SE,Sexual Orientation,Not Reported,ADW,2200  Savannah St SE Washington DC,"2200, Savannah Street Southeast, Shipley, Washington, District of Columbia, 20020, United States",38.8475077,-76.972956,20020
2020-05-12,410,2020-05-12,2020,5,20070828,3,600 B/O Florida Ave NW,Sexual Orientation,Not Reported,Simple Assault,600  Florida Ave NW Washington DC,"Rito Loco, 600, Florida Avenue Northwest, Shaw, Common Good Farm, Washington, District of Columbia, 20001, United States",38.915408,-77.020389,20060
2020-05-14,1900,2020-05-14,2020,5,20072147,2,3200 B/O Connecticut Ave NW,Sexual Orientation,Not Reported,Violation of CPO,3200  Connecticut Ave NW Washington DC,"3200, Connecticut Avenue Northwest, Northwest, Cleveland Park, Washington, District of Columbia, 20008, United States",38.93265,-77.056928,20015
2020-05-15,1535,2020-05-15,2020,5,20072508,3,1900 B/O 2nd ST NW,Ethnicity/National Origin,Chinese,Threats,1900  2nd ST NW Washington DC,"1900, 2nd Street Northwest, Shaw, Common Good Farm, Washington, District of Columbia, 20001, United States",38.916395,-77.014536,20001
2020-05-30,2046,2020-05-30,2020,5,20080038,3,1400 B/O U St NW,Sexual Orientation,Not Reported,Simple Assault,1400  U St NW Washington DC,"1400, U Street Northwest, Greater U Street Historic District, Dupont Circle, Washington, District of Columbia, 20009, United States",38.916915,-77.032106,20009
2020-06-09,1200,2020-06-10,2020,6,20086027,2,3800 B/O Van Ness St NW,Sexual Orientation,Not Reported,Damage/Defacing/Destruction of Property,3800  Van Ness St NW Washington DC,"3800, Van Ness Street Northwest, North Cleveland Park, American University Park, Washington, District of Columbia, 20016, United States",38.943085,-77.07476,20016
2020-06-11,1237,2020-06-11,2020,6,20086508,5,1100 B/O 1st St NE,Race,Black,Damage/Defacing/Destruction of Property,1100  1st St NE Washington DC,"1100, 1st Street Northeast, NoMa, Near Northeast, Washington, District of Columbia, 20002, United States",38.9040127,-77.00653279348728,20002
2020-06-13,1923,2020-06-13,2020,6,20087683,3,1600 B/O 11th St NW,Race,Black,Simple Assault,1600  11th St NW Washington DC,"1600, 11th Street Northwest, Logan Circle/Shaw, Washington, District of Columbia, 20001, United States",38.911245,-77.02714,20001
2020-06-20,2300,2020-06-20,2020,6,20090833,4,5800 B/O Colorado Ave NW,Gender Identity/Expression,Not Reported,Threats,5800  Colorado Ave NW Washington DC,"5800, Colorado Avenue Northwest, Brightwood Park, Washington, District of Columbia, 20011, United States",38.96034,-77.029597,20012
2020-06-21,215,2020-06-21,2020,6,20090914,7,100 B/O Atlantic St SE,Gender Identity/Expression,Not Reported,Simple Assault,100  Atlantic St SE Washington DC,"100, Atlantic Street Southeast, Washington, District of Columbia, 20032, United States",38.831271,-77.005711,20032
2020-06-24,1445,2020-06-24,2020,6,20092431,1,700 B/O 7th St NW,Gender Identity/Expression,Not Reported,Simple Assault,700  7th St NW Washington DC,"OBA Federal Savings Bank, 700, 7th Street Northwest, Washington, District of Columbia, 20001, United States",38.8986274,-77.0221885,20001
2020-06-26,1719,2020-06-26,2020,6,20093439,2,2800 B/O M St NW,Ethnicity/National Origin,Jewish,Displaying Symbols,2800  M St NW Washington DC,"2800, M Street Northwest, Georgetown, Washington, District of Columbia, 20007, United States",38.905158,-77.057072,20007
2020-06-29,120,2020-06-29,2020,6,20094517,2,Key Bridge,Ethnicity/National Origin,Latino/Hispanic,Simple Assault,Key Bridge Washington DC,"Key Bridge, Capital Crescent Trail, Georgetown Reservoir, Georgetown, Washington, District of Columbia, 20057, United States",38.90308555,-77.0695215558204,20057
2020-06-29,1317,2020-06-29,2020,6,20094673,2,3200 B/O R St NW,Race,Black,Threats,3200  R St NW Washington DC,"3200, R Street Northwest, Georgetown, Washington, District of Columbia, 20007, United States",38.913574,-77.064405,20007
2020-06-29,2100,2020-06-30,2020,6,20095170,4,1300 B/O Tewkesbury Pl NW,Ethnicity/National Origin,Latino/Hispanic,ADW,1300  Tewkesbury Pl NW Washington DC,"1300, Tewkesbury Place Northwest, Brightwood, Washington, District of Columbia, 20012, United States",38.96819,-77.029841,20012
2020-07-04,508,2020-07-04,2020,7,20096720,1,900 B/O 6th St NE,Gender Identity/Expression,Not Reported,Simple Assault,900  6th St NE Washington DC,"900, 6th Street Northeast, Near Northeast, Washington, District of Columbia, 20002, United States",38.901448,-76.998548,20002
2020-07-06,1845,2020-07-06,2020,7,20097915,2,900 B/O 16th ST NW,Political Affiliation,Not Reported,Robbery,900  16th ST NW Washington DC,"900, Black Lives Matter Plaza Northwest, Golden Triangle, Washington, District of Columbia, 20006, United States",38.901468,-77.036648,20012
2020-07-07,1330,2020-07-09,2020,7,20098960,6,2300 B/O Good Hope Rd SE,Sexual Orientation,Not Reported,Threats,2300  Good Hope Rd SE Washington DC,"2300, Good Hope Road Southeast, Skyland, Washington, District of Columbia, 20020, United States",38.8645478,-76.9741515,20020
2020-07-08,830,2020-07-12,2020,7,20100365,2,5400 B/O Connecticut Ave NW,Gender Identity/Expression,Not Reported,Threats,5400  Connecticut Ave NW Washington DC,"5400, Connecticut Avenue Northwest, Chevy Chase, American University Park, Washington, District of Columbia, 20015, United States",38.961095,-77.073468,20015
2020-07-14,930,2020-07-14,2020,7,20101213,1,1300 B/O Pennsylvania Ave NW,Race,White,Threats,1300  Pennsylvania Ave NW Washington DC,"Woodrow Wilson International Center for Scholars, 1300, Pennsylvania Avenue Northwest, Washington, District of Columbia, 20004, United States",38.8933288,-77.030034,20004
2020-07-14,2022,2020-07-15,2020,7,20101545,6,6000 B/O Clay St NE,Sexual Orientation,Not Reported,Threats,6000  Clay St NE Washington DC,"6000, Clay Street Northeast, Northeast Boundary, Washington, District of Columbia, 20019, United States",38.892976,-76.914875,20019
2020-07-18,908,2020-07-18,2020,7,20103116,1,1000 B/O H St NE,Race,White,Simple Assault,1000  H St NE Washington DC,"C.A.T. Walk Boutique, 1000, H Street Northeast, Near Northeast, Washington, District of Columbia, 20002, United States",38.9003634,-76.9924934,20002
2020-07-23,1951,2020-07-23,2020,7,20105592,4,1400 B/O Sheridan St NW,Ethnicity/National Origin,Latino/Hispanic,Threats,1400  Sheridan St NW Washington DC,"1400, Sheridan Street Northwest, Brightwood, Washington, District of Columbia, 20011, United States",38.966055,-77.033573,20011
2020-07-26,1,2020-07-28,2020,7,20107661,1,400 B/O North Capitol St NW,Race,Black,Threats,400  North Capitol St NW Washington DC,"400, North Capitol Street Northwest, Washington, District of Columbia, 20001, United States",38.895227,-77.009162,20002
2020-07-20,1400,2020-07-30,2020,7,20108581,1,900 B/O 6th St SW,Race,Black,Simple Assault,900  6th St SW Washington DC,"900, 6th Street Southwest, Southwest Waterfront, Washington, District of Columbia, 20024, United States",38.879162,-77.019785,20024
2020-07-31,1914,2020-07-31,2020,7,20109364,1,200 B/O L St SW,Ethnicity/National Origin,Arab/Middle Eastern,Simple Assault,200  L St SW Washington DC,"200, L Street Southwest, Southwest Waterfront, Washington, District of Columbia, 20024, United States",38.877447,-77.013771,20024
2020-07-28,2030,2020-08-02,2020,8,20109907,2,1300 B/O New Hampshire Ave NW,Race,White,Threats,1300  New Hampshire Ave NW Washington DC,"1300, New Hampshire Avenue Northwest, Washington, District of Columbia, 20036, United States",38.90739,-77.045672,20036
2020-08-02,1018,2020-08-02,2020,8,20110164,3,Unit B/O O St NW,Sexual Orientation,Not Reported,Threats,O St NW Washington DC,"O Street Northwest, Truxton Circle, Washington, District of Columbia, 20554, United States",38.90857,-77.0136668,20001
2020-08-02,1500,2020-08-02,2020,8,20110250,2,Unit B/O Dupont Cir NW,Sexual Orientation,Not Reported,Simple Assault,  Dupont Cir NW Washington DC,"Dupont Circle Northwest, Dupont Circle and surrunding block, Dupont Circle, Washington, District of Columbia, 20036, United States",38.9091496,-77.0439183,20036
2020-08-05,2028,2020-08-05,2020,8,20111972,3,1800 B/O Belmont Rd NW,Sexual Orientation,Not Reported,Simple Assault,1800  Belmont Rd NW Washington DC,"1800, Belmont Road Northwest, Adams Morgan, Washington, District of Columbia, 20009, United States",38.9204402,-77.0421461,20009
2020-08-10,1430,2020-08-10,2020,8,20114260,2,6100 B/O 16th St NW,Ethnicity/National Origin,Latino/Hispanic,Threats,6100  16th St NW Washington DC,"6100, 16th Street Northwest, Washington, District of Columbia, 20011, United States",38.964958,-77.03652,20012
2020-08-10,1252,2020-08-11,2020,8,20114944,3,1000 B/O U St NW,Race,Black,Threats,1000  U St NW Washington DC,"CVS Pharmacy, 1000, U Street Northwest, Greater U Street Historic District, Washington, District of Columbia, 20060, United States",38.9168527,-77.0261698,20060
2020-08-11,711,2020-08-11,2020,8,20114564,5,800 B/O Bladensburg Rd NE,Sexual Orientation,Not Reported,Threats,800  Bladensburg Rd NE Washington DC,"800, Bladensburg Road Northeast, Carver, Washington, District of Columbia, 20002, United States",38.90033,-76.983404,20002
2020-08-18,2129,2020-08-19,2020,8,20118216,3,2300 B/O Champlain St NW,Sexual Orientation,Not Reported,Threats,2300  Champlain St NW Washington DC,"2300, Champlain Street Northwest, Adams Morgan, Washington, District of Columbia, 20009, United States",38.9202109,-77.04104964166666,20009
2020-08-19,941,2020-08-19,2020,8,20118372,6,4700 B/O C St SE,Ethnicity/National Origin,Latino/Hispanic,Simple Assault,4700  C St SE Washington DC,"4700, C Street Southeast, Marshall Heights, Washington, District of Columbia, 20019, United States",38.886043,-76.93574,20019
2020-08-23,1601,2020-08-23,2020,8,20120522,3,1300 B/O P St NW,Sexual Orientation,Not Reported,Threats,1300  P St NW Washington DC,"1300, P Street Northwest, Logan Circle/Shaw, Dupont Circle, Washington, District of Columbia, 20005, United States",38.909565,-77.031058,20005
2020-08-24,101,2020-08-24,2020,8,20120734,4,6500 B/O Georgia Ave NW,Gender Identity/Expression,Not Reported,Simple Assault,6500  Georgia Ave NW Washington DC,"Georgia Avenue Northwest, Takoma, Washington, District of Columbia, 20012, United States",38.9837103,-77.0265877,20012
2020-08-25,1057,2020-08-25,2020,8,20121347,6,4000 B/O Minnesota Ave NE,Gender Identity/Expression,Not Reported,Threats,4000  Minnesota Ave NE Washington DC,"4000, Minnesota Avenue Northeast, Central Northeast, Washington, District of Columbia, 20019, United States",38.89528,-76.94918,20019
2020-08-25,1145,2020-08-25,2020,8,20121378,4,7500 B/O Georgia Ave NW,Gender Identity/Expression,Not Reported,Threats,7500  Georgia Ave NW Washington DC,"7500, Georgia Avenue Northwest, Takoma, Washington, District of Columbia, 20012, United States",38.981396,-77.0268409,20012
2020-08-26,1242,2020-08-26,2020,8,20121968,2,1800 B/O R St NW,Ethnicity/National Origin,Jewish,Threats,1800  R St NW Washington DC,"1800, R Street Northwest, Dupont Circle, Washington, District of Columbia, 20009-5540, United States",38.9124491,-77.042048,20009
2020-08-31,2224,2020-08-31,2020,8,20124652,2,1100 B/O 15th St NW,Sexual Orientation,Not Reported,ADW,1100  15th St NW Washington DC,"15th Street Northwest, Washington, District of Columbia, 20005, United States",38.9007003,-77.0336365,20005
2020-09-01,2041,2020-09-01,2020,9,20125104,7,400 B/O Condon Ter SE,Sexual Orientation,Not Reported,Threats,400  Condon Ter SE Washington DC,"400, Condon Terrace Southeast, Washington Highlands, Washington, District of Columbia, 20032, United States",38.831376,-77.000445,20032
2020-09-04,924,2020-09-04,2020,9,20126270,4,900 B/O Randolph St NW,Race,Black,Threats,900  Randolph St NW Washington DC,"900, Randolph Street Northwest, Petworth, Washington, District of Columbia, 20011, United States",38.938599,-77.024843,20011
2020-09-06,1216,2020-09-06,2020,9,20127423,5,1800 B/O West Virginia Ave NE,Gender Identity/Expression,Not Reported,Simple Assault,1800  West Virginia Ave NE Washington DC,"1800, West Virginia Avenue Northeast, Ivy City, Washington, District of Columbia, 20002, United States",38.910863,-76.985455,20002
2020-09-06,1554,2020-09-06,2020,9,20127520,4,800 B/O Geranium St NW,Race,White,Simple Assault,800  Geranium St NW Washington DC,"800, Geranium Street Northwest, Takoma, Washington, District of Columbia, 20012, United States",38.979308,-77.024609,20012
2020-09-10,2310,2020-09-11,2020,9,20129748,3,1100 B/O U St NW,Gender Identity/Expression,Not Reported,ADW,1100  U St NW Washington DC,"1100, U Street Northwest, Greater U Street Historic District, Washington, District of Columbia, 20060, United States",38.9168439,-77.027265,20060
2020-09-13,1302,2020-09-13,2020,9,20130981,4,5400 B/O Georgia Ave NW,Ethnicity/National Origin,Latino/Hispanic,Damage/Defacing/Destruction of Property,5400  Georgia Ave NW Washington DC,"Georgia Avenue Northwest, Takoma, Washington, District of Columbia, 20012, United States",38.9837103,-77.0265877,20012
2020-09-18,2202,2020-09-18,2020,9,20133775,3,2000 B/O Wyoming Ave NW,Ethnicity/National Origin,Jewish,Threats,2000  Wyoming Ave NW Washington DC,"2000, Wyoming Avenue Northwest, Adams Morgan, Washington, District of Columbia, 20009, United States",38.918087,-77.045812,20009
2020-09-18,1130,2020-09-18,2020,9,20133457,3,1300 B/O Fairmont St NW,Sexual Orientation,Not Reported,Threats,1300  Fairmont St NW Washington DC,"1300, Fairmont Street Northwest, Columbia Heights, Washington, District of Columbia, 20009, United States",38.924673,-77.029867,20009
2020-09-23,1921,2020-09-23,2020,9,20136153,7,4200 B/O 4th ST SE,Gender Identity/Expression,Not Reported,Threats,4200  4th ST SE Washington DC,"4200, 4th Street Southeast, Washington Highlands, Washington, District of Columbia, 20032, United States",38.829082,-77.000458,20032
2020-09-24,1422,2020-09-24,2020,9,20136564,4,6600 B/O 16th St NW,Race,Black,Simple Assault,6600  16th St NW Washington DC,"6600, 16th Street Northwest, Brightwood, Washington, District of Columbia, 20012, United States",38.96992215,-77.03681479119851,20012
2020-09-26,1959,2020-09-26,2020,9,20137693,1,400 B/O H St NW,Race,Black,Simple Assault,400  H St NW Washington DC,"400, H Street Northwest, Washington, District of Columbia, 20001, United States",38.899711,-77.017607,20548
2020-09-27,1440,2020-09-27,2020,9,20138100,4,600 B/O Kennedy St NW,Gender Identity/Expression,Not Reported,Simple Assault,600  Kennedy St NW Washington DC,"600, Kennedy Street Northwest, Brightwood Park, Washington, District of Columbia, 20011, United States",38.956330205549726,-77.02110365745088,20011
2020-09-27,2225,2020-09-27,2020,9,20138274,3,900 B/O U St NW,Sexual Orientation,Not Reported,Simple Assault,900  U St NW Washington DC,"900, U Street Northwest, Greater U Street Historic District, Washington, District of Columbia, 20001, United States",38.916912,-77.024114,20009
2020-09-29,1714,2020-09-29,2020,9,20139267,1,600 B/O H St NW,Race,White,Threats,600  H St NW Washington DC,"600, H Street Northwest, Chinatown, Washington, District of Columbia, 20001, United States",38.899729,-77.020065,20001
