2018-04-10,305,2018-04-10,2018,4,18056813,3,900 B/O Florida Ave NW,Race,White,Simple Assault,900  Florida Ave NW Washington DC,"900, Florida Avenue Northwest, Cardozo/Shaw, Washington, District of Columbia, 20060, United States",38.9176919,-77.0242196,20009
2018-04-14,2156,2018-04-14,2018,4,18059835,2,1200 B/O 28th ST NW,Religion,Muslim,Damage/Defacing/Destruction of Property,1200  28th ST NW Washington DC,"1200, 28th Street Northwest, Georgetown, Washington, District of Columbia, 20007, United States",38.905351,-77.057124,20007
2018-04-15,31,2018-04-15,2018,4,18059930,3,2000 B/O 10th St NW,Sexual Orientation,Not Reported,ADW,2000  10th St NW Washington DC,"2000, 10th Street Northwest, Cardozo/Shaw, Washington, District of Columbia, 20001, United States",38.91712,-77.026093,20009
2018-04-15,1512,2018-04-15,2018,4,18060233,4,3700 B/O Georgia Ave NW,Sexual Orientation,Not Reported,Simple Assault,3700  Georgia Ave NW Washington DC,"3700, Georgia Avenue Northwest, Petworth, Washington, District of Columbia, 20012, United States",38.937121,-77.0247125,20010
2018-04-15,2302,2018-04-16,2018,4,18060442,4,3600 B/O 14th ST NW,Ethnicity/National Origin,Latino/Hispanic,Robbery,3600  14th ST NW Washington DC,"Nationwide, 3600, 14th Street Northwest, Petworth, Columbia Heights, Washington, District of Columbia, 20010, United States",38.9364355,-77.032968,20010
2018-04-17,2038,2018-04-17,2018,4,18061553,2,1200 B/O G St NW,Ethnicity/National Origin,Black,Robbery,1200  G St NW Washington DC,"Klug Law Office PLLC, 1200, G Street Northwest, Downtown, Washington, District of Columbia, 20005, United States",38.89814,-77.0282319,20005
2018-04-20,1118,2018-04-20,2018,4,18063031,3,2500 B/O Georgia Ave NW,Race,Black,Damage/Defacing/Destruction of Property,2500  Georgia Ave NW Washington DC,"Georgia Avenue Northwest, Takoma, Washington, District of Columbia, 20012, United States",38.9837103,-77.0265877,20012
2018-04-21,1432,2018-04-21,2018,4,18063758,2,1800 B/O M St NW,Race,White,Threats,1800  M St NW Washington DC,"Capital One, 1800, M Street Northwest, Golden Triangle, Washington, District of Columbia, 20036, United States",38.905422,-77.0422081,20036
2018-04-22,2111,2018-04-22,2018,4,18064464,7,4000 B/O 4th ST SE,Sexual Orientation,Not Reported,Threats,4000  4th ST SE Washington DC,"4000, 4th Street Southeast, Washington Highlands, Washington, District of Columbia, 20032, United States",38.830837,-77.000462,20032
2018-04-23,1820,2018-04-23,2018,4,18064958,3,3100 B/O Mount Pleasant St NW,Ethnicity/National Origin,Latino/Hispanic,Simple Assault,3100  Mount Pleasant St NW Washington DC,"Irving Wine and Spirits, 3100, Mount Pleasant Street Northwest, Mount Pleasant, Washington, District of Columbia, 20009, United States",38.9288851,-77.0376476,20009
2018-04-30,1639,2018-04-30,2018,4,18068967,2,Unit B/O 15th St SW,Race,Black,Threats,  15th St SW Washington DC,"15th Street Southwest, Washington, District of Columbia, 20250, United States",38.8892146,-77.0328984,20250
2018-05-11,2213,2018-05-12,2018,5,18076135,7,100 B/O Galveston Pl SW,Gender Identity/Expression,Not Reported,Simple Assault,100  Galveston Pl SW Washington DC,"Galveston Place Southwest, Bellevue, Washington, District of Columbia, 20032, United States",38.824384,-77.009837,20032
2018-05-04,1630,2018-05-16,2018,5,18078915,2,1400 B/O New York Ave NW,Race,Black,Threats,1400  New York Ave NW Washington DC,"1400, New York Avenue Northwest, Downtown, Washington, District of Columbia, 20005, United States",38.899267,-77.032048,20005
2018-05-16,1130,2018-05-16,2018,5,18078733,2,1000 B/O Wisconsin Ave NW,Sexual Orientation,Not Reported,Threats,1000  Wisconsin Ave NW Washington DC,"1000, Wisconsin Avenue Northwest, Georgetown, Washington, District of Columbia, 20566, United States",38.9028012,-77.0629136,20566
2018-05-17,1610,2018-05-18,2018,5,18079974,2,1300 B/O New York Ave NW,Ethnicity/National Origin,Latino/Hispanic,Threats,1300  New York Ave NW Washington DC,"Inter-American Development Bank, 1300, New York Avenue Northwest, Downtown, Washington, District of Columbia, 20005, United States",38.89939685,-77.03051222530138,20005
2018-05-19,2000,2018-05-19,2018,5,18080756,3,1400 B/O Irving St NW,Sexual Orientation,Not Reported,Simple Assault,1400  Irving St NW Washington DC,"Lou's City Bar, 1400, Irving Street Northwest, Columbia Heights, Washington, District of Columbia, 20010, United States",38.9284992,-77.033826,20010
2018-05-19,2310,2018-05-20,2018,5,18080901,1,1200 B/O Half St SE,Ethnicity/National Origin,Latino/Hispanic,Threats,1200  Half St SE Washington DC,"1200, Half Street Southeast, Navy Yard, Washington, District of Columbia, 20003, United States",38.87636,-77.007351,20590
2018-05-20,100,2018-05-21,2018,5,18081726,3,700 B/O Harvard St NW,Sexual Orientation,Not Reported,Robbery,700  Harvard St NW Washington DC,"700, Harvard Street Northwest, Pleasant Plains, Washington, District of Columbia, 20001, United States",38.927098,-77.023056,20001
2018-05-25,1430,2018-05-26,2018,5,18084660,4,1400 B/O Perry Pl NW,Sexual Orientation,Not Reported,Damage/Defacing/Destruction of Property,1400  Perry Pl NW Washington DC,"1400, Perry Place Northwest, Columbia Heights, Washington, District of Columbia, 20010, United States",38.936225,-77.032912,20010
2018-05-27,310,2018-05-27,2018,5,18085245,2,1900 B/O M St NW,Race,Black,Simple Assault,1900  M St NW Washington DC,"Rumors, 1900, M Street Northwest, Golden Triangle, Washington, District of Columbia, 20036-5305, United States",38.9053627,-77.0435758,20036
2018-05-27,1828,2018-05-27,2018,5,18085566,3,1300 B/O 14th St NW,Sexual Orientation,Not Reported,Simple Assault,1300  14th St NW Washington DC,"1300, 14th Street Northwest, Logan Circle/Shaw, Washington, District of Columbia, 20005, United States",38.907851,-77.032052,20005
2018-06-01,1045,2018-06-01,2018,6,18088385,1,700 B/O I St NE,Sexual Orientation,Not Reported,Simple Assault,700  I St NE Washington DC,"700, I Street Northeast, Near Northeast, Washington, District of Columbia, 20002, United States",38.90141,-76.996006,20002
2018-06-01,1928,2018-06-01,2018,6,18088713,5,900 B/O Rhode Island Ave NE,Ethnicity/National Origin,Latino/Hispanic,Threats,900  Rhode Island Ave NE Washington DC,"900, Rhode Island Avenue Northeast, Washington, District of Columbia, 20018, United States",38.922167,-76.993773,20018
2018-06-04,949,2018-06-04,2018,6,18090063,5,1100 B/O Oates St NE,Gender Identity/Expression,Not Reported,Simple Assault,1100  Oates St NE Washington DC,"1100, Oates Street Northeast, Carver, Washington, District of Columbia, 20002, United States",38.906397,-76.990207,20002
2018-06-05,2116,2018-06-05,2018,6,18091166,4,400 B/O Peabody St NW,Sexual Orientation,Not Reported,Simple Assault,400  Peabody St NW Washington DC,"400, Peabody Street Northwest, Brightwood, Washington, District of Columbia, 20011, United States",38.962617,-77.018187,20011
2018-06-05,2307,2018-06-06,2018,6,18091220,1,500 B/O H St NW,Race,Black,Threats,500  H St NW Washington DC,"Fairfield Inn, 500, H Street Northwest, Chinatown, Washington, District of Columbia, 20548, United States",38.8993983,-77.01917105989855,20548
2018-06-06,1736,2018-06-06,2018,6,18091675,4,5600 B/O 1st St NE,Race,Black,Threats,5600  1st St NE Washington DC,"5600, 1st Street Northeast, Manor Park, Washington, District of Columbia, 20011, United States",38.957779,-77.006372,20011
2018-06-07,4,2018-06-07,2018,6,18091886,1,100 B/O 7th St NW,Sexual Orientation,Not Reported,Simple Assault,100  7th St NW Washington DC,"100, 7th Street Northwest, Washington, District of Columbia, 20004, United States",38.890662,-77.02201,20565
2018-06-10,1700,2018-06-10,2018,6,18094116,3,1600 B/O R St NW,Sexual Orientation,Not Reported,Damage/Defacing/Destruction of Property,1600  R St NW Washington DC,"1600, R Street Northwest, Dupont Circle, Washington, District of Columbia, 20009, United States",38.912527,-77.03667,20009
2018-06-10,1650,2018-06-10,2018,6,18094124,1,1600 B/O A St SE,Race,White,Simple Assault,1600  A St SE Washington DC,"1600, A Street Southeast, Hill East, Washington, District of Columbia, 20003, United States",38.888755,-76.982056,20003
2018-06-13,1746,2018-06-13,2018,6,18096064,2,1600 B/O P St NW,Ethnicity/National Origin,Latino/Hispanic,Threats,1600  P St NW Washington DC,"1600, P Street Northwest, Logan Circle/Shaw, Dupont Circle, Washington, District of Columbia, 20036, United States",38.909561,-77.03668,20036
2018-06-13,2350,2018-06-14,2018,6,18096291,6,100 B/O 47th St NE,Sexual Orientation,Not Reported,Robbery,100  47th St NE Washington DC,"100, 47th Street Northeast, Capitol View, Washington, District of Columbia, 20019, United States",38.890409,-76.934981,20019
2018-06-15,1423,2018-06-15,2018,6,18097244,2,5300 B/O Wisconsin Ave NW,Race,Black,Simple Assault,5300  Wisconsin Ave NW Washington DC,"5300, Wisconsin Avenue Northwest, Friendship Heights, Washington, District of Columbia, 20015, United States",38.960176,-77.085535,20007
2018-06-16,40,2018-06-16,2018,6,18097619,3,1600 B/O 17th St NW,Sexual Orientation,Not Reported,Damage/Defacing/Destruction of Property,1600  17th St NW Washington DC,"1600, 17th Street Northwest, Dupont Circle, Washington, District of Columbia, 20009, United States",38.91125,-77.038588,20009
2018-06-16,213,2018-06-16,2018,6,18097663,6,3800 B/O Minnesota Ave NE,Sexual Orientation,Not Reported,Threats,3800  Minnesota Ave NE Washington DC,"3800, Minnesota Avenue Northeast, Benning, Washington, District of Columbia, 20019, United States",38.892437,-76.95127,20019
2018-06-17,402,2018-06-17,2018,6,18098318,2,1700 B/O M St NW,Gender Identity/Expression,Not Reported,Simple Assault,1700  M St NW Washington DC,"1700, M Street Northwest, Golden Triangle, Washington, District of Columbia, 20036, United States",38.90557,-77.038656,20036
2018-06-17,2215,2018-06-18,2018,6,18098804,6,1300 B/O Good Hope Rd SE,Gender Identity/Expression,Not Reported,Robbery,1300  Good Hope Rd SE Washington DC,"1300, Good Hope Road Southeast, Washington, District of Columbia, 20020, United States",38.8672716,-76.9868185,20020
2018-06-21,1206,2018-06-21,2018,6,18101001,5,1200 B/O 6th St NE,Ethnicity/National Origin,Latino/Hispanic,Threats,1200  6th St NE Washington DC,"1200, 6th Street Northeast, Near Northeast, Washington, District of Columbia, 20002, United States",38.905767,-76.998545,20002
2018-06-22,2001,2018-06-22,2018,6,18101936,4,7000 B/O Blair Rd NW,Ethnicity/National Origin,Latino/Hispanic,Simple Assault,7000  Blair Rd NW Washington DC,"7000, Blair Road Northwest, Takoma, Washington, District of Columbia, 20012, United States",38.97478,-77.018427,20012
2018-06-26,1445,2018-06-26,2018,6,18104343,2,1000 B/O 14th St NW,Ethnicity/National Origin,Asian,ADW,1000  14th St NW Washington DC,"1000, 14th Street Northwest, Downtown, Washington, District of Columbia, 20005, United States",38.902647,-77.032057,20071
2018-06-27,1728,2018-06-27,2018,6,18104966,2,1200 B/O Wisconsin Ave NW,Sexual Orientation,Not Reported,Stalking,1200  Wisconsin Ave NW Washington DC,"1200, Wisconsin Avenue Northwest, Georgetown, Washington, District of Columbia, 20007, United States",38.90550075356415,-77.0629212938391,20007
2018-06-29,49,2018-06-29,2018,6,18105946,3,2300 B/O 18th St NW,Political Affiliation,Not Reported,ADW,2300  18th St NW Washington DC,"The Madrid, 2300, 18th Street Northwest, Adams Morgan, Washington, District of Columbia, 20009, United States",38.9199289,-77.04199528390282,20009
2018-06-29,117,2018-06-29,2018,6,18105958,3,1300 B/O U St NW,Ethnicity/National Origin,Latino/Hispanic,ADW,1300  U St NW Washington DC,"U Street Northwest, Cardozo/Shaw, Washington, District of Columbia, 20060, United States",38.9170073,-77.0281836,20009
2018-06-29,658,2018-06-29,2018,6,18106025,1,300 B/O D St SW,Ethnicity/National Origin,Arab/Middle Eastern,Damage/Defacing/Destruction of Property,300  D St SW Washington DC,"300, D Street Southwest, Southwest Employment Area, Washington, District of Columbia, 20024, United States",38.884991,-77.015357,20024
2018-06-29,1817,2018-06-29,2018,6,18106333,5,1200 B/O Quincy St NE,Race,White,Simple Assault,1200  Quincy St NE Washington DC,"1200, Quincy Street Northeast, University Heights, Washington, District of Columbia, 20017, United States",38.937327,-76.98953790470344,20017
2018-06-29,2145,2018-06-30,2018,6,18106702,2,3100 B/O M St NW,Ethnicity/National Origin,Jewish,Damage/Defacing/Destruction of Property,3100  M St NW Washington DC,"Potomac Wines And Spirits, 3100, M Street Northwest, Georgetown, Washington, District of Columbia, 20566, United States",38.9050473,-77.0613139,20566
2018-07-01,1711,2018-07-01,2018,7,18107476,2,4400 B/O Connecticut Ave NW,Ethnicity/National Origin,Latino/Hispanic,Simple Assault,4400  Connecticut Ave NW Washington DC,"Days Inn Connecticut Ave, 4400, Connecticut Avenue Northwest, Washington, District of Columbia, 20015, United States",38.9469838,-77.0655634,20015
2018-07-02,1714,2018-07-02,2018,7,18108061,2,1400 B/O M St NW,Ethnicity/National Origin,Jewish,Damage/Defacing/Destruction of Property,1400  M St NW Washington DC,"Westin Washington D.C City Centre, 1400, M Street Northwest, Downtown, Washington, District of Columbia, 20007, United States",38.9053157,-77.0334361,20007
2018-07-02,1853,2018-07-02,2018,7,18108146,2,4500 B/O Garfield St NW,Ethnicity/National Origin,Jewish,Damage/Defacing/Destruction of Property,4500  Garfield St NW Washington DC,"4500, Garfield Street Northwest, Wesley Heights, Washington, District of Columbia, 20007, United States",38.927447,-77.088788,20007
2018-07-03,2040,2018-07-03,2018,7,18108875,3,3100 B/O 14th St NW,Sexual Orientation,Not Reported,Simple Assault,3100  14th St NW Washington DC,"Letena, 3100, 14th Street Northwest, Columbia Heights, Washington, District of Columbia, 20010, United States",38.9303999,-77.0335651,20010
2018-07-04,1413,2018-07-04,2018,7,18109277,7,4600 B/O Martin Luther King Jr Ave SW,Gender Identity/Expression,Not Reported,Threats,4600  Martin Luther King Jr Ave SW Washington DC,"4600, Martin Luther King Junior Avenue Southwest, Bellevue, Washington, District of Columbia, 20032, United States",38.824294,-77.01208,20375
2018-07-06,7,2018-07-06,2018,7,18110306,1,800 B/O 7th ST NW,Gender Identity/Expression,Not Reported,Simple Assault,800  7th ST NW Washington DC,"800, 7th Street Northwest, Chinatown, Washington, District of Columbia, 20001, United States",38.899936,-77.022017,20001
2018-07-06,1309,2018-07-06,2018,7,18110527,5,2400 B/O Market St NE,Race,Asian,Simple Assault,2400  Market St NE Washington DC,"Market Street Northeast, Fort Lincoln, Washington, District of Columbia, 20722, United States",38.9210069,-76.9550156,20722
2018-07-07,2334,2018-07-07,2018,7,18111503,1,700 B/O 6th St NW,Race,Black,Simple Assault,700  6th St NW Washington DC,"Penn Commons, 700, 6th Street Northwest, Washington, District of Columbia, 20001, United States",38.8987596,-77.0201233,20001
2018-07-09,631,2018-07-09,2018,7,18112174,2,1700 B/O Rhode Island Ave NW,Race,Black,Simple Assault,1700  Rhode Island Ave NW Washington DC,"1700, Rhode Island Avenue Northwest, Golden Triangle, Washington, District of Columbia, 20036, United States",38.90573,-77.040608,20036
2018-07-11,1546,2018-07-11,2018,7,18113700,2,1700 B/O Pennsylvania Ave NW,Ethnicity/National Origin,Asian,Threats,1700  Pennsylvania Ave NW Washington DC,"Wells Fargo, 1700, Pennsylvania Avenue Northwest, Golden Triangle, Washington, District of Columbia, 20006, United States",38.8986346,-77.0399253,20006
2018-07-14,2229,2018-07-15,2018,7,18115852,7,3000 B/O 5th ST SE,Sexual Orientation,Not Reported,Robbery,3000  5th ST SE Washington DC,"3000, 5th Street Southeast, Congress Heights, Washington, District of Columbia, 20032, United States",38.846393,-77.000477,20032
2018-07-15,358,2018-07-15,2018,7,18115984,2,700 B/O 10th St NW,Sexual Orientation,Not Reported,Simple Assault,700  10th St NW Washington DC,"700, 10th Street Northwest, Downtown, Washington, District of Columbia, 20001, United States",38.898443,-77.026095,20005
2018-07-19,1625,2018-07-19,2018,7,18118973,1,700 B/O 9th ST NW,Ethnicity/National Origin,Black,Simple Assault,700  9th ST NW Washington DC,"700, 9th Street Northwest, Downtown, Washington, District of Columbia, 20001, United States",38.899177,-77.024069,20001
2018-07-21,1,2018-07-21,2018,7,18120309,2,2300 B/O M St NW,Ethnicity/National Origin,Jewish,Damage/Defacing/Destruction of Property,2300  M St NW Washington DC,"Medical Faculty Association GWU, 2300, M Street Northwest, West End, Washington, District of Columbia, 20007, United States",38.9050601,-77.0504838,20007
2018-07-25,2300,2018-07-26,2018,7,18123007,1,700 B/O 4th ST SE,Race,White,Damage/Defacing/Destruction of Property,700  4th ST SE Washington DC,"700, 4th Street Southeast, Capitol Hill, Washington, District of Columbia, 20003, United States",38.881147,-77.000468,20003
2018-07-28,1700,2018-07-28,2018,7,18124744,3,800 B/O Mount Vernon Pl NW,Sexual Orientation,Not Reported,Simple Assault,800  Mount Vernon Pl NW Washington DC,"800, Mount Vernon Place Northwest, Washington, District of Columbia, 20001, United States",38.902863,-77.023021,20001
2018-07-30,1259,2018-08-02,2018,8,18127751,2,800 B/O 16th St NW,Religion,Jewish,Damage/Defacing/Destruction of Property,800  16th St NW Washington DC,"Hay-Adams Hotel, 800, Black Lives Matter Plaza Northwest, Golden Triangle, Washington, District of Columbia, 20006, United States",38.90050395,-77.03689992471391,20006
2018-08-02,752,2018-08-02,2018,8,18127579,7,3300 B/O Wheeler Rd SE,Ethnicity/National Origin,Latino/Hispanic,Simple Assault,3300  Wheeler Rd SE Washington DC,"3300, Wheeler Road Southeast, Congress Heights, Washington, District of Columbia, 20032, United States",38.842117,-76.993834,20032
2018-08-06,141,2018-08-06,2018,8,18129957,2,1200 B/O Wisconsin Ave NW,Race,Black,ADW,1200  Wisconsin Ave NW Washington DC,"1200, Wisconsin Avenue Northwest, Georgetown, Washington, District of Columbia, 20007, United States",38.90550075356415,-77.0629212938391,20007
2018-08-09,139,2018-08-09,2018,8,18131818,3,1900 B/O 14th St NW,Race,Black,Simple Assault,1900  14th St NW Washington DC,"1900, 14th Street Northwest, Cardozo/Shaw, Washington, District of Columbia, 2005, United States",38.9157027,-77.0322117,20009
2018-08-10,927,2018-08-10,2018,8,18132548,5,2100 B/O I St NE,Gender Identity/Expression,Not Reported,Threats,2100  I St NE Washington DC,"2100, I Street Northeast, Langston, Washington, District of Columbia, 20002, United States",38.90333300963952,-76.97306954282345,20002
2018-08-10,1822,2018-08-10,2018,8,18132857,2,2500 B/O Pennsylvania Ave NW,Ethnicity/National Origin,Jewish,Damage/Defacing/Destruction of Property,2500  Pennsylvania Ave NW Washington DC,"Avenue Suites, 2500, Pennsylvania Avenue Northwest, West End, Washington, District of Columbia, 20037, United States",38.9034654,-77.0536656,20037
2018-08-11,212,2018-08-11,2018,8,18133101,4,6500 B/O Georgia Ave NW,Sexual Orientation,Not Reported,Simple Assault,6500  Georgia Ave NW Washington DC,"Georgia Avenue Northwest, Takoma, Washington, District of Columbia, 20012, United States",38.9837103,-77.0265877,20012
2018-08-12,1700,2018-08-12,2018,8,18133968,2,1300 B/O New York Ave NW,Political Affiliation,Not Reported,Simple Assault,1300  New York Ave NW Washington DC,"Inter-American Development Bank, 1300, New York Avenue Northwest, Downtown, Washington, District of Columbia, 20005, United States",38.89939685,-77.03051222530138,20005
2018-08-12,2300,2018-08-13,2018,8,18134315,7,1200 B/O Valley Ter SE,Sexual Orientation,Not Reported,Damage/Defacing/Destruction of Property,1200  Valley Ter SE Washington DC,"Valley Terrace Southeast, Washington, District of Columbia, 20032, United States",38.8413,-76.977121,20032
2018-08-15,0,2018-08-15,2018,8,18135346,5,1300 B/O Brentwood Rd NE,Sexual Orientation,Not Reported,Threats,1300  Brentwood Rd NE Washington DC,"1300, Brentwood Road Northeast, Brookland, Washington, District of Columbia, 20018, United States",38.924458,-76.986587,20018
2018-08-08,940,2018-08-16,2018,8,18136300,3,3600 B/O 16th St NW,Sexual Orientation,Not Reported,Threats,3600  16th St NW Washington DC,"3600, 16th Street Northwest, Washington, District of Columbia, 20010, United States",38.93509,-77.036554,20010
2018-08-17,1353,2018-08-17,2018,8,18136864,2,2000 B/O P St NW,Ethnicity/National Origin,Asian,Simple Assault,2000  P St NW Washington DC,"Toronto, 2000, P Street Northwest, Dupont Circle, Washington, District of Columbia, 20036-5305, United States",38.9094647,-77.0451401,20036
2018-08-18,1820,2018-08-18,2018,8,18137691,6,5000 B/O Hayes St NE,Gender Identity/Expression,Not Reported,Threats,5000  Hayes St NE Washington DC,"5000, Hayes Street Northeast, Deanwood, Washington, District of Columbia, 20019, United States",38.89994,-76.928343,20019
2018-08-21,1815,2018-08-21,2018,8,18139639,2,6600 B/O 31st St NW,Race,Black,ADW,6600  31st St NW Washington DC,"6600, 31st Street Northwest, Barnaby Woods, Washington, District of Columbia, 20015, United States",38.975687,-77.056433,20015
2018-08-25,2030,2018-08-25,2018,8,18142329,2,2300 B/O M St NW,Ethnicity/National Origin,Jewish,Damage/Defacing/Destruction of Property,2300  M St NW Washington DC,"Medical Faculty Association GWU, 2300, M Street Northwest, West End, Washington, District of Columbia, 20007, United States",38.9050601,-77.0504838,20007
2018-08-26,1920,2018-08-26,2018,8,18142923,5,1700 B/O Gales St NE,Race,Black,Damage/Defacing/Destruction of Property,1700  Gales St NE Washington DC,"1700, Gales St NE, Kingman Park, Washington, District of Columbia, 20002, United States",38.898166,-76.97949,20002
2018-08-27,1119,2018-08-27,2018,8,18143313,5,4000 B/O 22nd St NE,Race,White,Simple Assault,4000  22nd St NE Washington DC,"4000, 22nd Street Northeast, Woodridge, Washington, District of Columbia, 20018, United States",38.93843,-76.974279,20018
2018-08-27,1249,2018-08-27,2018,8,18143342,6,3200 B/O Pennsylvania Ave SE,Race,White,Threats,3200  Pennsylvania Ave SE Washington DC,"Planet Fitness, 3200, Pennsylvania Avenue Southeast, Washington, District of Columbia, 20020, United States",38.8699723,-76.9600534,20020
2018-08-27,1549,2018-08-27,2018,8,18143488,2,5700 B/O Broad Branch Rd NW,Ethnicity/National Origin,Latino/Hispanic,Threats,5700  Broad Branch Rd NW Washington DC,"5700, Broad Branch Road Northwest, Chevy Chase, Washington, District of Columbia, 20015, United States",38.9659,-77.068559,20015
2018-08-28,123,2018-08-28,2018,8,18143814,2,1500 B/O P St NW,Sexual Orientation,Not Reported,Simple Assault,1500  P St NW Washington DC,"1500, P Street Northwest, Logan Circle/Shaw, Dupont Circle, Washington, District of Columbia, 2005, United States",38.9095121,-77.0347821,20005
2018-08-28,610,2018-08-28,2018,8,18143849,7,1900 B/O Martin Luther King Jr Ave SE,Sexual Orientation,Not Reported,Damage/Defacing/Destruction of Property,1900  Martin Luther King Jr Ave SE Washington DC,"1900, Martin Luther King Junior Avenue Southeast, Anacostia, Washington, District of Columbia, 20020, United States",38.867273,-76.988577,20020
2018-08-28,2217,2018-08-29,2018,8,18144420,3,3100 B/O Mount Pleasant St NW,Ethnicity/National Origin,Latino/Hispanic,ADW,3100  Mount Pleasant St NW Washington DC,"Irving Wine and Spirits, 3100, Mount Pleasant Street Northwest, Mount Pleasant, Washington, District of Columbia, 20009, United States",38.9288851,-77.0376476,20009
2018-08-29,1251,2018-08-29,2018,8,18144698,2,1100 B/O 15th St NW,Political Affiliation,Not Reported,Threats,1100  15th St NW Washington DC,"15th Street Northwest, Washington, District of Columbia, 20005, United States",38.9007003,-77.0336365,20005
2018-08-30,818,2018-08-30,2018,8,18145283,2,1100 B/O K St NW,Ethnicity/National Origin,Black,Simple Assault,1100  K St NW Washington DC,"1100, K Street Northwest (access road), Golden Triangle, Washington, District of Columbia, 20036, United States",38.90389425,-77.03701503311464,20036
2018-08-30,1614,2018-08-30,2018,8,18145520,4,5500 B/O 9th St NW,Ethnicity/National Origin,Latino/Hispanic,ADW,5500  9th St NW Washington DC,"5500, 9th Street Northwest, Brightwood Park, Washington, District of Columbia, 20011, United States",38.956397,-77.025866,20011
2018-08-31,1821,2018-08-31,2018,8,18146310,5,500 B/O Rhode Island Ave NE,Gender Identity/Expression,Not Reported,Threats,500  Rhode Island Ave NE Washington DC,"500, Rhode Island Avenue Northeast, Washington, District of Columbia, 20002, United States",38.92051445985401,-76.99863137956204,20260
2018-09-01,1721,2018-09-01,2018,9,18146892,5,2300 B/O 4th St NE,Gender Identity/Expression,Not Reported,Threats,2300  4th St NE Washington DC,"2300, 4th Street Northeast, Edgewood, Washington, District of Columbia, 20002, United States",38.920352,-77.000673,20002
2018-09-02,2050,2018-09-02,2018,9,18147554,3,600 B/O Florida Ave NW,Sexual Orientation,Not Reported,Simple Assault,600  Florida Ave NW Washington DC,"Rito Loco, 600, Florida Avenue Northwest, Shaw, Common Good Farm, Washington, District of Columbia, 20001, United States",38.915408,-77.020389,20060
2018-09-04,1905,2018-09-04,2018,9,18148709,1,600 B/O H St NW,Sexual Orientation,Not Reported,Damage/Defacing/Destruction of Property,600  H St NW Washington DC,"600, H Street Northwest, Chinatown, Washington, District of Columbia, 20001, United States",38.899729,-77.020065,20001
2018-09-04,2104,2018-09-04,2018,9,18148791,1,600 B/O H St NW,Sexual Orientation,Not Reported,Simple Assault,600  H St NW Washington DC,"600, H Street Northwest, Chinatown, Washington, District of Columbia, 20001, United States",38.899729,-77.020065,20001
2018-09-07,1422,2018-09-07,2018,9,18150682,1,1200 B/O North Capitol St NW,Gender Identity/Expression,Not Reported,Affrays,1200  North Capitol St NW Washington DC,"1200, North Capitol Street Northwest, NoMa, Washington, District of Columbia, 20554, United States",38.906396,-77.00944655,20554
