2016-06-06,1623,2016-06-06,2016,6,16091695,6,3900 B/O Benning Rd NE,Sexual Orientation,Not Reported,Simple Assault,3900  Benning Rd NE Washington DC,"Shop Express, 3900, Benning Road Northeast, Washington, District of Columbia, 20019, United States",38.8952269,-76.9485300061566,20019
2016-06-10,0020,2016-06-10,2016,6,16094095,7,2300 B/O Green St SE,Sexual Orientation,Not Reported,ADW,2300  Green St SE Washington DC,"2300, Green Street Southeast, Anacostia, Washington, District of Columbia, 20020, United States",38.862485,-76.981705,20020
2016-06-11,1045,2016-06-11,2016,6,16094964,3,2400 B/O Sherman Ave NW,Race,Black,Simple Assault,2400  Sherman Ave NW Washington DC,"2400, Sherman Avenue Northwest, Columbia Heights, Washington, District of Columbia, 20001, United States",38.92179412524858,-77.02540613242515,20001
2016-06-13,0400,2016-06-13,2016,6,16096316,2,2000 B/O S St NW,Sexual Orientation,Not Reported,Damage/Defacing/Destruction of Property,2000  S St NW Washington DC,"2000, S Street Northwest, Dupont Circle, Washington, District of Columbia, 20009-5540, United States",38.9139309,-77.0451336,20009
2016-06-14,1730,2016-06-14,2016,6,16097126,1,900 B/O H St NW,Gender Identity/Expression,Not Reported,Threats,900  H St NW Washington DC,"900, H Street Northwest, Downtown, Washington, District of Columbia, 20001, United States",38.899729,-77.024121,20001
2016-06-15,0726,2016-06-15,2016,6,16097438,3,1700 B/O 16th St NW,Religion,Jewish,Damage/Defacing/Destruction of Property,1700  16th St NW Washington DC,"1700, 16th Street Northwest, Greater U Street Historic District, Dupont Circle, Washington, District of Columbia, 20009, United States",38.912733,-77.036617,20012
2016-06-12,0400,2016-06-16,2016,6,16098404,3,2300 B/O 18th St NW,Sexual Orientation,Not Reported,Damage/Defacing/Destruction of Property,2300  18th St NW Washington DC,"The Madrid, 2300, 18th Street Northwest, Adams Morgan, Washington, District of Columbia, 20009, United States",38.9199289,-77.04199528390282,20009
2016-06-20,1900,2016-06-20,2016,6,16102041,3,1500 B/O North Capitol St NW,Gender Identity/Expression,Not Reported,Robbery,1500  North Capitol St NW Washington DC,"1500, North Capitol Street Northwest, Truxton Circle, Washington, District of Columbia, 20554, United States",38.9097918,-77.009311,20554
2016-06-21,2016,2016-06-21,2016,6,16106888,3,1600 B/O 17th St NW,Sexual Orientation,Not Reported,Simple Assault,1600  17th St NW Washington DC,"1600, 17th Street Northwest, Dupont Circle, Washington, District of Columbia, 20009, United States",38.91125,-77.038588,20009
2016-06-22,2352,2016-06-23,2016,6,16102589,2,1800 B/O 18th St NW,Sexual Orientation,Not Reported,ADW,1800  18th St NW Washington DC,"1800, 18th Street Northwest, Dupont Circle, Washington, District of Columbia, 20009-5540, United States",38.9143526,-77.0418872481546,20009
2016-06-23,1730,2016-06-23,2016,6,16103122,7,1300 B/O Alabama Ave SE,Sexual Orientation,Not Reported,Threats,1300  Alabama Ave SE Washington DC,"1300, Alabama Avenue Southeast, Washington, District of Columbia, 20032, United States",38.845056,-76.987412,20020
2016-06-23,2000,2016-06-23,2016,6,16103204,3,400 B/O O St NW,Race,White,Threats,400  O St NW Washington DC,"400, O Street Northwest, Logan Circle/Shaw, Washington, District of Columbia, 20001, United States",38.908488,-77.016327,20001
2016-06-25,2016,2016-06-25,2016,6,16104355,2,3100 B/O M St NW,Race,White,Simple Assault,3100  M St NW Washington DC,"Potomac Wines And Spirits, 3100, M Street Northwest, Georgetown, Washington, District of Columbia, 20566, United States",38.9050473,-77.0613139,20566
2016-06-25,1946,2016-06-25,2016,6,16104521,5,800 B/O Bladensburg Rd NE,Sexual Orientation,Not Reported,ADW,800  Bladensburg Rd NE Washington DC,"800, Bladensburg Road Northeast, Carver, Washington, District of Columbia, 20002, United States",38.90033,-76.983404,20002
2016-06-01,1730-1732,2016-07-06,2016,7,16111639,2,2400 B/O Tracy Pl NW,Religion,Jewish,Damage/Defacing/Destruction of Property,2400  Tracy Pl NW Washington DC,"2400, Tracy Place Northwest, Kalorama Heights, Washington, District of Columbia, 20008, United States",38.916203,-77.052756,20008
2016-07-06,2015-2019,2016-07-06,2016,7,16111756,2,5200 B/O 42nd St NW,Race,White,Threats,5200  42nd St NW Washington DC,"5200, 42nd Street Northwest, Friendship Heights, Washington, District of Columbia, 20015, United States",38.957147,-77.082126,20015
2016-07-08,0333-0350,2016-07-08,2016,7,16112589,7,1500 B/O Alabama Ave SE,Sexual Orientation,Not Reported,ADW,1500  Alabama Ave SE Washington DC,"1500, Alabama Avenue Southeast, Douglass, Washington, District of Columbia, 20032, United States",38.846214,-76.982982,20020
2016-07-12,1035-1050,2016-07-12,2016,7,16115031,5,1500 B/O Benning Rd NE,Gender Identity/Expression,Not Reported,Threats,1500  Benning Rd NE Washington DC,"1500, Benning Road Northeast, Carver, Washington, District of Columbia, 20002, United States",38.9002011,-76.9818082,20002
2016-07-12,2135-2150,2016-07-13,2016,7,16115421,1,600 B/O I St NW,Race,Black,Threats,600  I St NW Washington DC,"600, I Street Northwest, Chinatown, Washington, District of Columbia, 20001, United States",38.900785,-77.020064,20001
2016-07-14,1630-1649,2016-07-14,2016,7,16116491,3,1100 B/O Rhode Island Ave NW,Sexual Orientation,Not Reported,Simple Assault,1100  Rhode Island Ave NW Washington DC,"Logan Circle Laundry, 1100, Rhode Island Avenue Northwest, Logan Circle/Shaw, Washington, District of Columbia, 2005, United States",38.91004605,-77.02734942736612,20005
2016-07-17,0020-0021,2016-07-17,2016,7,16118067,3,900 B/O U St NW,Race,Black,Simple Assault,900  U St NW Washington DC,"900, U Street Northwest, Greater U Street Historic District, Washington, District of Columbia, 20001, United States",38.916912,-77.024114,20009
2016-07-17,1930-1940,2016-07-17,2016,7,16118491,4,200 B/O Cedar St NW,Religion,Muslim,Threats,200  Cedar St NW Washington DC,"200, Cedar Street Northwest, Takoma, Washington, District of Columbia, 20012, United States",38.976021,-77.015714,20912
2016-07-19,0000-1710,2016-07-23,2016,7,16119683,2,1100 B/O 20th St NW,Religion,Jewish,Damage/Defacing/Destruction of Property,1100  20th St NW Washington DC,"1100, 20th Street Northwest, Golden Triangle, Washington, District of Columbia, 20036, United States",38.903866,-77.045002,20005
2016-07-23,1005-1010,2016-07-23,2016,7,16122110,2,3100 B/O 34th St NW,Ethnicity/National Origin,Unspecified,Threats,3100  34th St NW Washington DC,"3100, 34th Street Northwest, Cleveland Park, Washington, District of Columbia, 20008, United States",38.931591,-77.066492,20008
2016-07-25,2233-2343,2016-07-26,2016,7,16123724,7,2600 B/O Martin Luther King Ave SE,Sexual Orientation,Not Reported,Threats,2600  Martin Luther King Jr Ave SE Washington DC,"2600, Martin Luther King Junior Avenue Southeast, Barry Farm, Washington, District of Columbia, 20020, United States",38.859156,-76.99516,20020
2016-07-25,1830-1835,2016-07-26,2016,7,16214281,5,1900 B/O 13th St NW,Sexual Orientation,Not Reported,ADW,1900  13th St NW Washington DC,"13th Street Northwest, Brightwood, Washington, District of Columbia, 20012, United States",38.9689791,-77.0296871,20012
2016-08-01,1902-2017,2016-08-01,2016,8,16128121,2,2650 B/O Massachusetts Ave NW,Religion,Muslim,Threats,2650  Massachusetts Ave NW Washington DC,"Massachusetts Avenue Northwest, Dupont Circle, Washington, District of Columbia, 20036-5305, United States",38.9107152,-77.0465155,20036
2016-08-03,0110-0700,2016-08-03,2016,8,16129021,6,100 B/O Division Ave NE,Sexual Orientation,Not Reported,Threats,100  Division Ave NE Washington DC,"100, Division Avenue Northeast, Capitol View, Washington, District of Columbia, 20019, United States",38.890904,-76.928066,20019
2016-08-06,0405,2016-08-06,2016,8,16131000,7,2400 B/O Alabama Ave SE,Ethnicity/National Origin,Latino/Hispanic,Robbery,2400  Alabama Ave SE Washington DC,"2400, Alabama Avenue Southeast, Buena Vista, Washington, District of Columbia, 20020, United States",38.851415,-76.972087,20020
2016-08-21,1800-2059,2016-08-22,2016,8,16141289,1,400 B/O 7th St NW,Religion,Jewish,Damage/Defacing/Destruction of Property,400  7th St NW Washington DC,"400, 7th Street Northwest, Penn Quarter, Washington, District of Columbia, 20001, United States",38.8949765,-77.02222919566688,20001
2016-08-23,0012-0013,2016-08-23,2016,8,16141375,1,600 B/O H St NW,Religion,Jewish,Damage/Defacing/Destruction of Property,600  H St NW Washington DC,"600, H Street Northwest, Chinatown, Washington, District of Columbia, 20001, United States",38.899729,-77.020065,20001
2016-08-25,1234-1411,2016-08-25,2016,8,16142973,6,900 B/O Eastern Ave NW,Gender Identity/Expression,Not Reported,Simple Assault,900  Eastern Ave NW Washington DC,"Eastern Avenue Northwest, Shepherd Park, Washington, Montgomery County, District of Columbia, 20910, United States",38.9919323,-77.0360419,20910
2016-08-28,0411-0503,2016-08-28,2016,8,16144770,3,3300 B/O 14th St NW,Gender Identity/Expression,Not Reported,Simple Assault,3300  14th St NW Washington DC,"PNC Bank, 3300, 14th Street Northwest, Columbia Heights, Washington, District of Columbia, 20010, United States",38.9304498,-77.0329824,20010
2016-09-06,2250-2310,2016-09-07,2016,9,16150940,4,6900 B/O Georgia Ave NW,Ethnicity/National Origin,Latino/Hispanic,Simple Assault,6900  Georgia Ave NW Washington DC,"Georgia Avenue Northwest, Takoma, Washington, District of Columbia, 20012, United States",38.9837103,-77.0265877,20012
2016-09-14,0045,2016-09-14,2016,9,16155806,7,900 B/O Blakney Lane SE,Gender Identity/Expression,Not Reported,Threats,900  Blakney Lane SE Washington DC,"900, Blakney Lane Southeast, Washington Highlands, Washington, District of Columbia, 20032, United States",38.836408,-76.992014,20032
2016-09-16,1715,2016-09-16,2016,9,16157283,1,100 B/O 4th St SE,Disability,Not Reported,Simple Assault,100  4th St SE Washington DC,"100, 4th Street Southeast, Capitol Hill, Washington, District of Columbia, 20003, United States",38.888559,-77.000466,20003
2016-09-23,2151-2215,2016-09-23,2016,9,16162028,3,400 B/O Florida Ave NW,Race,White,Simple Assault,400  Florida Ave NW Washington DC,"KoChix, 400, Florida Avenue Northwest, Shaw, Washington, District of Columbia, 20001, United States",38.9137423,-77.0163479,20001
2016-09-24,1000-1030,2016-09-24,2016,9,16162304,2,4800 B/O Massachusetts Ave NW,Religion,Jewish,Threats,4800  Massachusetts Ave NW Washington DC,"4800, Massachusetts Avenue Northwest, Spring Valley, American University Park, Washington, District of Columbia, 20016, United States",38.944434,-77.094985,20016
2016-09-26,1853-1857,2016-09-26,2016,9,16163918,2,700 B/O 11th St NW,Sexual Orientation,Not Reported,Threats,700  11th St NW Washington DC,"Cos, 700, 11th Street Northwest, Downtown, Washington, District of Columbia, 20001, United States",38.8985573,-77.0275939,20001
2016-10-01,1300-1720,2016-10-03,2016,10,16168163,3,1400 B/O Corcoran St NW,Race,Black,Damage/Defacing/Destruction of Property,1400  Corcoran St NW Washington DC,"1400, Corcoran Street Northwest, Logan Circle/Shaw, Washington, District of Columbia, 20009, United States",38.911785,-77.032103,20009
2016-10-05,1145-1238,2016-10-05,2016,10,16169200,5,1500 B/O Maryland Ave NE,Gender Identity/Expression,Not Reported,Simple Assault,1500  Maryland Ave NE Washington DC,"1500, Maryland Avenue Northeast, Carver, Washington, District of Columbia, 20002, United States",38.900806,-76.981987,20002
2016-10-07,2030-2036,2016-10-08,2016,10,16170819,7,1600 B/O Morris Rd SE,Ethnicity/National Origin,Black,Threats,1600  Morris Rd SE Washington DC,"1600, Morris Road Southeast, Washington, District of Columbia, 20020, United States",38.857144120841504,-76.98191964856481,20020
2016-10-16,0240-0320,2016-10-16,2016,10,16175768,1,3800 B/O 14th St NW,Gender Identity/Expression,Not Reported,Simple Assault,3800  14th St NW Washington DC,"3800, 14th Street Northwest, Petworth, Columbia Heights, Washington, District of Columbia, 20011, United States",38.938024,-77.032832,20010
2016-10-16,0306-0352,2016-10-16,2016,10,16175772,3,1900 B/O 8th St NW,Sexual Orientation,Not Reported,Simple Assault,1900  8th St NW Washington DC,"1900, 8th Street Northwest, Greater U Street Historic District, Washington, District of Columbia, 20001, United States",38.915695,-77.023048,20001
2016-10-16,1542-1642,2016-10-16,2016,10,16176048,7,1300 B/O Congress St SE,Gender Identity/Expression,Not Reported,ADW,1300  Congress St SE Washington DC,"1300, Congress Street Southeast, Congress Heights, Washington, District of Columbia, 20032, United States",38.841971,-76.988383,20032
2016-10-19,0522-0525,2016-10-19,2016,10,16177646,1,800 B/O 7th St NE,Gender Identity/Expression,Not Reported,Simple Assault,800  7th St NE Washington DC,"800, 7th Street Northeast, Near Northeast, Washington, District of Columbia, 20002, United States",38.900328,-76.99627,20002
2016-10-22,0313,2016-10-22,2016,10,16179656,2,2300 B/O Wisconsin Ave NW,Sexual Orientation,Not Reported,Simple Assault,2300  Wisconsin Ave NW Washington DC,"2300, Wisconsin Avenue Northwest, Glover Park, Washington, District of Columbia, 20007, United States",38.920202,-77.071601,20007
2016-10-23,1714-1821,2016-10-23,2016,10,16180630,1,Unit B/O Massachusetts Ave NE,Sexual Orientation,Not Reported,ADW,  Massachusetts Ave NE Washington DC,"Massachusetts Avenue Northeast, NoMa, Washington, District of Columbia, 20002, United States",38.8970854,-77.0079521,20002
2016-10-22,0300-1057,2016-10-24,2016,10,16181036,2,2100 B/O S St NW,Sexual Orientation,Not Reported,Threats,2100  S St NW Washington DC,"Embassy of the Republic of Albania, 2100, S Street Northwest, Kalorama Heights, Dupont Circle, Washington, District of Columbia, 20008, United States",38.91389145,-77.04698827148141,20008
2016-10-30,0151-0345,2016-10-30,2016,10,16184816,3,600 B/O Florida Ave NW,Sexual Orientation,Not Reported,Simple Assault,600  Florida Ave NW Washington DC,"Rito Loco, 600, Florida Avenue Northwest, Shaw, Common Good Farm, Washington, District of Columbia, 20001, United States",38.915408,-77.020389,20060
2016-10-31,2246,2016-11-01,2016,11,16186020,2,4300 B/O Prospect St NW,Sexual Orientation,Not Reported,Robbery,4300  Prospect St NW Washington DC,"Prospect Street Northwest, Georgetown, Washington, District of Columbia, 20057, United States",38.9059747,-77.0660053,20057
2016-11-04,1745,2016-11-04,2016,11,16188074,3,2500 B/O 9th St NW,Ethnicity/National Origin,Latino/Hispanic,Threats,2500  9th St NW Washington DC,"2500, 9th Street Northwest, Columbia Heights, Washington, District of Columbia, 20001, United States",38.920892,-77.024181,20059
2016-11-04,1551,2016-11-04,2016,11,16188276,3,1500 B/O 4th St NW,Gender Identity/Expression,Not Reported,ADW,1500  4th St NW Washington DC,"1500, 4th Street Northwest, Truxton Circle, Washington, District of Columbia, 20001, United States",38.909766,-77.016265,20001
2016-11-05,2000-1059,2016-11-06,2016,11,16189410,2,1400 B/O Foxhall Rd NW,Political Affiliation,Not Reported,Damage/Defacing/Destruction of Property,1400  Foxhall Rd NW Washington DC,"1400, Foxhall Road Northwest, Foxhall Village, Washington, District of Columbia, 20007, United States",38.9071057,-77.0815392,20007
2016-11-07,2040,2016-11-07,2016,11,16190338,4,3700 B/O Georgia Ave NW,Gender Identity/Expression,Not Reported,Simple Assault,3700  Georgia Ave NW Washington DC,"3700, Georgia Avenue Northwest, Petworth, Washington, District of Columbia, 20012, United States",38.937121,-77.0247125,20010
2016-11-12,0000-1030,2016-11-13,2016,11,16193410,2,2900 B/O Bellevue Ter NW,Religion,Jewish,Damage/Defacing/Destruction of Property,2900  Bellevue Ter NW Washington DC,"2900, Bellevue Terrace Northwest, Cathedral Heights, Glover Park, Washington, District of Columbia, 20016, United States",38.92765,-77.075942,20016
2016-11-13,0105,2016-11-17,2016,11,16195957,2,3700 B/O O St NW,Religion,Muslim,Simple Assault,3700  O St NW Washington DC,"Georgetown University, 3700, O Street Northwest, Georgetown, Washington, District of Columbia, 20057, United States",38.90893925,-77.07457962060826,20057
2016-11-18,0215,2016-11-18,2016,11,16196212,2,1900 B/O M St NW,Political Affiliation,Not Reported,ADW,1900  M St NW Washington DC,"Rumors, 1900, M Street Northwest, Golden Triangle, Washington, District of Columbia, 20036-5305, United States",38.9053627,-77.0435758,20036
2016-11-19,0409,2016-11-19,2016,11,16196907,3,700 B/O Florida Ave NW,Sexual Orientation,Not Reported,ADW,700  Florida Ave NW Washington DC,"700, Florida Avenue Northwest, Cardozo/Shaw, Washington, District of Columbia, 20001, United States",38.91625,-77.022079,20001
2016-11-20,0545-0630,2016-11-20,2016,11,16197526,4,3800 B/O Georgia Ave NW,Sexual Orientation,Not Reported,Simple Assault,3800  Georgia Ave NW Washington DC,"Georgia Avenue Northwest, Takoma, Washington, District of Columbia, 20012, United States",38.9837103,-77.0265877,20012
2016-11-28,1910,2016-11-28,2016,11,16202012,6,5300 B/O Dix St NE,Sexual Orientation,Not Reported,Simple Assault,5300  Dix St NE Washington DC,"5300, Dix Street Northeast, Grant Park, Washington, District of Columbia, 20019, United States",38.895119,-76.924515,20019
2016-12-09,1130,2016-12-09,2016,12,16208137,7,3300 B/O 10th Pl SE,Sexual Orientation,Not Reported,Simple Assault,3300  10th Pl SE Washington DC,"3300, 10th Place Southeast, Congress Heights, Washington, District of Columbia, 20032, United States",38.842494,-76.992043,20032
2016-12-17,0152,2016-12-17,2016,12,16212622,2,1200 B/O 24th St NW,Religion,Christian,Simple Assault,1200  24th St NW Washington DC,"24th Street Northwest, West End, Washington, District of Columbia, 20036-5305, United States",38.9038189,-77.051409,20037
2016-12-17,2015,2016-12-17,2016,12,16213049,1,600 B/O H St NW,Gender Identity/Expression,Not Reported,Simple Assault,600  H St NW Washington DC,"600, H Street Northwest, Chinatown, Washington, District of Columbia, 20001, United States",38.899729,-77.020065,20001
2016-12-17,2041,2016-12-17,2016,12,16213056,1,540 B/O L St NW,Sexual Orientation,Not Reported,Threats,540  L St NW Washington DC,"540, L Street Northwest, Mount Vernon Square, Washington, District of Columbia, 20001, United States",38.90408593668937,-77.01923840246383,20001
2017-01-05,1533,2017-01-06,2017,1,17003228,7,3400 B/O 4th ST SE,Sexual Orientation,Not Reported,Threats,3400  4th ST SE Washington DC,"3400, 4th Street Southeast, Congress Heights, Washington, District of Columbia, 20032, United States",38.840269,-77.000465,20032
2017-01-15,1812,2017-01-15,2017,1,17008389,1,700 B/O 7th St NW,Political Affiliation,Not Reported,Simple Assault,700  7th St NW Washington DC,"OBA Federal Savings Bank, 700, 7th Street Northwest, Washington, District of Columbia, 20001, United States",38.8986274,-77.0221885,20001
2017-01-17,1340,2017-01-17,2017,1,17009376,2,3800 B/O Reservoir Rd NW,Race,Black,ADW,3800  Reservoir Rd NW Washington DC,"MedStar Georgetown University Hospital, 3800, Reservoir Road Northwest, Burleith/Hillandale, Georgetown, Washington, District of Columbia, 20007, United States",38.91148265,-77.07519316890705,20057
2017-01-21,50,2017-01-21,2017,1,17011418,3,1700 B/O New Hampshire Ave NW,Religion,Jewish,Simple Assault,1700  New Hampshire Ave NW Washington DC,"1700, New Hampshire Avenue Northwest, Dupont Circle, Washington, District of Columbia, 20009, United States",38.912756,-77.040648,20009
2017-01-21,253,2017-01-21,2017,1,17011454,5,2200 B/O Douglas St NE,Political Affiliation,Not Reported,Damage/Defacing/Destruction of Property,2200  Douglas St NE Washington DC,"2200, Douglas Street Northeast, Langdon, Washington, District of Columbia, 20018, United States",38.92352,-76.974014,20018
2017-01-26,703,2017-01-26,2017,1,17014388,6,1700 B/O R St SE,Gender Identity/Expression,Not Reported,ADW,1700  R St SE Washington DC,"1700, R Street Southeast, Fairlawn, Washington, District of Columbia, 20020, United States",38.869558,-76.980612,20020
2017-01-27,300,2017-01-27,2017,1,17014929,2,1700 B/O Massachusetts Ave NW,Religion,Jewish,Damage/Defacing/Destruction of Property,1700  Massachusetts Ave NW Washington DC,"1700, Massachusetts Avenue Northwest, Dupont Circle, Washington, District of Columbia, 20036, United States",38.907899,-77.038679,20036
2017-01-29,300,2017-01-29,2017,1,17016247,2,1700 B/O N St NW,Political Affiliation,Not Reported,ADW,1700  N St NW Washington DC,"1700, N Street Northwest, Dupont Circle, Washington, District of Columbia, 20036, United States",38.90716,-77.038651,20036
2017-02-04,1900,2017-02-04,2017,2,17020132,3,1300 B/O Vermont Ave NW,Sexual Orientation,Not Reported,ADW,1300  Vermont Ave NW Washington DC,"1300, Vermont Avenue Northwest, Logan Circle/Shaw, Washington, District of Columbia, 20005, United States",38.9075041,-77.0312208,20005
2017-02-06,1700,2017-02-07,2017,2,17021479,2,2800 B/O Wisconsin Ave NW,Religion,Jewish,Threats,2800  Wisconsin Ave NW Washington DC,"2800, Wisconsin Avenue Northwest, Washington, District of Columbia, 20007, United States",38.926305,-77.073291,20007
2017-02-17,225,2017-02-17,2017,2,17027193,3,2400 B/O 18th St NW,Race,Black,Simple Assault,2400  18th St NW Washington DC,"2400, 18th Street Northwest, Adams Morgan, Washington, District of Columbia, 20009, United States",38.92069,-77.042159,20009
2017-02-18,25,2017-02-18,2017,2,17027720,3,1800 B/O Columbia Rd NW,Ethnicity/National Origin,Black,Threats,1800  Columbia Rd NW Washington DC,"1800, Columbia Road Northwest, Adams Morgan, Washington, District of Columbia, 20009, United States",38.922519,-77.042737,20009
2017-02-03,1100,2017-02-20,2017,2,17029252,1,500 B/O Indiana Ave NW,Sexual Orientation,Not Reported,Simple Assault,500  Indiana Ave NW Washington DC,"H. Carl Moultrie Courthouse, 500, Indiana Avenue Northwest, Downtown East, Washington, District of Columbia, 20001, United States",38.8940619,-77.01880275004035,20001
2017-02-18,948,2017-02-21,2017,2,17029569,2,2800 B/O Wisconsin Ave NW,Religion,Jewish,Threats,2800  Wisconsin Ave NW Washington DC,"2800, Wisconsin Avenue Northwest, Washington, District of Columbia, 20007, United States",38.926305,-77.073291,20007
2017-02-21,1500,2017-02-21,2017,2,17029776,7,3300 B/O 6th St SE,Sexual Orientation,Not Reported,Damage/Defacing/Destruction of Property,3300  6th St SE Washington DC,"3300, 6th Street Southeast, Congress Heights, Washington, District of Columbia, 20032, United States",38.84210653325814,-76.99833801829527,20032
2017-02-22,1820,2017-02-23,2017,2,17031021,2,600 B/O 15th St NW,Sexual Orientation,Not Reported,Simple Assault,600  15th St NW Washington DC,"600, 15th Street Northwest, Washington, District of Columbia, 20005, United States",38.8975728,-77.034074,20006
2017-02-28,1555,2017-02-28,2017,2,17033942,4,400 B/O Shepherd St NW,Ethnicity/National Origin,Latino/Hispanic,Simple Assault,400  Shepherd St NW Washington DC,"400, Shepherd Street Northwest, Petworth, Washington, District of Columbia, 20011, United States",38.93988,-77.017436,20011
2017-02-23,1326,2017-03-03,2017,3,17035641,2,2100 B/O G St NW,Political Affiliation,Not Reported,Damage/Defacing/Destruction of Property,2100  G St NW Washington DC,"2100, G Street Northwest, George Washington University, Washington, District of Columbia, 20037, United States",38.89824,-77.046812,20052
2017-03-03,1705,2017-03-03,2017,3,17035857,2,3000 B/O M St NW,Race,White,Threats,3000  M St NW Washington DC,"3000, M Street Northwest, Georgetown, Washington, District of Columbia, 20007, United States",38.905136,-77.059323,20007
2017-02-17,2200,2017-03-08,2017,3,17038173,2,1300 B/O New Hampshire Ave NW,Ethnicity/National Origin,Latino/Hispanic,Simple Assault,1300  New Hampshire Ave NW Washington DC,"1300, New Hampshire Avenue Northwest, Washington, District of Columbia, 20036, United States",38.90739,-77.045672,20036
2017-03-08,1625,2017-03-08,2017,3,17038694,6,200 B/O 57th St NE,Gender Identity/Expression,Not Reported,Threats,200  57th St NE Washington DC,"200, 57th Street Northeast, Grant Park, Washington, District of Columbia, 20019, United States",38.891155,-76.920138,20019
2017-03-09,1650,2017-03-09,2017,3,17039367,4,3800 B/O Georgia Ave NW,Gender Identity/Expression,Not Reported,Threats,3800  Georgia Ave NW Washington DC,"Georgia Avenue Northwest, Takoma, Washington, District of Columbia, 20012, United States",38.9837103,-77.0265877,20012
2017-03-12,1400,2017-03-12,2017,3,17040976,3,2800 B/O Georgia Ave NW,Gender Identity/Expression,Not Reported,Damage/Defacing/Destruction of Property,2800  Georgia Ave NW Washington DC,"2800, Georgia Avenue Northwest, Pleasant Plains, Washington, District of Columbia, 20059, United States",38.9262032,-77.0230452,20059
2017-03-13,2115,2017-03-14,2017,3,17041805,1,400 B/O New Jersey Ave NW,Ethnicity/National Origin,Asian,Damage/Defacing/Destruction of Property,400  New Jersey Ave NW Washington DC,"Hyatt Regency Washington on Capitol Hill, 400, New Jersey Avenue Northwest, Downtown East, Washington, District of Columbia, 20001, United States",38.8955157,-77.01175359660192,20001
2017-03-16,200,2017-03-16,2017,3,17043129,3,1600 B/O R St NW,Sexual Orientation,Not Reported,ADW,1600  R St NW Washington DC,"1600, R Street Northwest, Dupont Circle, Washington, District of Columbia, 20009, United States",38.912527,-77.03667,20009
2017-03-19,1509,2017-03-20,2017,3,17044818,7,Unit B/O Galveston ST SW,Sexual Orientation,Not Reported,Threats,  Galveston ST SW Washington DC,"Galveston Street Southwest, Bellevue, Washington, District of Columbia, 20032, United States",38.8236,-77.008619,20032
2017-03-20,2302,2017-03-20,2017,3,17045690,5,1100 B/O Mount Olivet Rd NE,Gender Identity/Expression,Not Reported,Simple Assault,1100  Mount Olivet Rd NE Washington DC,"1100, Mount Olivet Road Northeast, Ivy City, Washington, District of Columbia, 20002, United States",38.910993,-76.987058,20002
